职位名称,公司名称,经验要求,学历,工作地点,最低薪水,最高薪水,职位描述,公司类型,最低员工人数,最高员工人数,主营业务
装饰总监,四川蓝光生态环境产业有限公司,5-7年经验,大专,成都,300000,500000,岗位职责：一、业务职责1、协助咨询管理组项目统筹工作，组内工程任务划分，组织项目的施工调查、项目策划以及管理规章制度交底工作。2、负责项目管理工作，负责牵头组织项目管理督导组开展工作，负责对承建的工程项目进行监管、及时处理实施中出现的施工组织、技术、质量安全管理、工程实体质量等方面的各类问题，负责对项目部监管工作进行考核通报。3、协助负责管理项目招投标相关事宜、图纸会审和重难点工程项目的技术总结编写、审查工作。4、协助负责项目合同管理、生产调度工作，确保公司生产指令和信息的畅通，负责工程项目信息系统管理工作。5、负责项目统计工作，编制上报项目年（季、月）度定期统计报表，对项目经营生产情况进行分析6、对管理项目进行专业检查，管控项目时间、质量、品质和安全。7、负责收尾项目管理，参与建设项目的竣工交验，协助。8、参与施工技术方案审查和重难点工程技术攻关，提供技术指导和技术服务。9、参与供应商和分包单位的管理。二、管理职能1、配合质量效果管理检查；2、配合工程管理制度的建立和修订，并进行检查和考核；3、贯彻执行公司标准化制度，对标准化运用执行情况进行检查和考核；4、做好人才梯队建设，组织培训和业务指导。三、其他1、负责完成所属区域下达的工作计划，完成部门的内控计划。任职要求：一、基本素质1、30-45岁，大专及以上学历，民建、工程管理、建筑工程等相关专业；2、七年以上装饰工程管理经验，三年以上项目团队管理经验；二、专业素质1、中级及以上职称，一级建造师优先；2、一级资质装饰企业工作经历优先；3、熟悉装饰技术管理路线，能合理管控项目质量。三、其他1、良好的执行力、分析判断、沟通能力；2、工作仔细，反应迅速，有一定分析能力；3、抗压能力强，有责任心，积极向上。,上市公司,500,1000,"房地产,建筑/建材/工程"
IT主管（连锁宠物医疗）,瓴域（上海）投资有限公司,3-4年经验,大专,武汉,5000,8000,岗位职责：1、总部IT指示下传达业务操作规范的各项标准，协助监督各分子公司实施情况，保持日常工作沟通和协调；根据公司发展战略，逐步拓展信息系统管理范围和深度，充分发挥信息化在企业管理中的积极作用；在总部IT带领下建立和完善信息化建设和管理的各项规章制度，实现管理的规范化、制度化、模板化；2、配合公司相关部门进行固定资产清理和盘点，对资产进行标示登记；3、监控、维护公司各业务系统并确保数据安全、正常使用；定期检查IT设备、通讯设备、网络设备及其附属配件的使用情况，建立这些设备和配件的备用机制和采购计划，提请相关部门进行采购处理，以满足公司日常工作需要；4、负责反馈各部门提出的业务系统BUG、功能需求等，帮助完善改进业务系统；5、参与组织公司业务系统培训，根据业务需求在系统中实现操作流程，为公司其他部门提供技术优化服务；6、处理常见服务器和PC系统故障、处理基本的网络通讯故障以及信息系统设备的维护。任职资格：1、大专及以上学历；2、4年以上工作经验；3、从事过网络工程\系统实施\项目管理等某种工作，在快消品、零售连锁、工厂制造业等某行业长达6年以上的优先；4、执行能力优秀、学习能力优秀、沟通能力优秀。,外资（非欧美）,1000,5000,"金融/投资/证券,互联网/电子商务"
智慧城市规划师,广东省电信规划设计院有限公司（东莞）第一分公司,3-4年经验,本科,东莞,150000,200000,一、岗位职责1、负责智慧城市规划项目咨询；2、负责智慧城市的常规性研究、产业分析报告撰写、调研实施等；3、负责针对客户需求的智慧城市相关应用解决方案的规划、组织、售前方案支持、咨询支持等；二、任职要求1、计算机、通信工程、信息系统管理、电子科学与技术、自动化与控制工程、经济管理等相关专业；2、本科及以上学历，国内外知名大学优先；3、有行业规划、园区规划等咨询经验；业务平台开发、方案制作等经验；4、具备较好的文字写作能力，具备熟练的数据分析能力，有从事互联网，IT通信、数字城市、智慧城市等规划设计经验者优先考虑；5、撰写过研究报告，能够承担报告主笔工作，具有一定的项目管理经验者优先考虑；6、有相关工作经验或咨询、研究、解决方案编写、售前支持等成功案例的优先考虑。三、待遇条件薪酬：年薪18-24万，五险一金+交通补贴+话费补贴+节日补贴+定期体检+补充商业保险待遇：五险一金，专业员工晋升通道，每周集体羽毛球，定期徒步踏青，定期工会活动，定期篮球、足球比赛，专业健身房、家庭俱乐部四、招聘人数：2名五、工作地点：广东东莞，国内,国企,150,500,通信/电信/网络设备
淘宝客服(职位编号：RM002),杭州哈雷纳金狐狸服饰有限公司,1年经验,中专,杭州-萧山区,3000,4500,1、负责接待网购客户的售前和售后咨询；2、负责有效的客户管理和沟通；3、负责促进订单完成的相关工作；4、负责建立客户档案，质量跟踪记录等售后服务信息系统管理。岗位要求：1、从事相关工作一年以上；2、有耐心、责任心，懂得跟客户沟通的技巧；3、能熟练操作旺旺等聊天工具及相关淘宝页面操作。,民营公司,50,150,服装/纺织/皮革
安全服务售前经理,北京天融信科技有限公司,3-4年经验,大专,昆明,10000,15000,1、负责售前信息安全、网络安全技术支持工作，负责分析客户需求、与客户进行交流，编写方案设计报告、实施方案报告和其他技术方案；2、随同销售人员拜访用户，了解用户的项目基本情况，了解用户的需求，向用户介绍公司和公司的产品，与用户建立起良好的关系；3、 参加招投标会，进行信息安全技术上的讲解和答疑；4、 参加商务和技术的谈判，参与起草项目技术协议书；5、 负责进行安全服务项目的实施，组织制定项目总体规划和实施设计，对项目实施全过程、全方面管理；6、 负责项目的进度、成本、质量、实施、风险等全部控制以及资源优化，组织做好各阶段服务的完工验收与结算工作。岗位要求：1、计算机、信息系统管理等相关专业专科以上学历；2、3年以上安全行业售前工作经验；1年以上项目经理管理经验；熟悉信息安全技术；理解咨询服务的理念和方法论；2、熟悉信息安全管理领域相关标准、规范，了解GB22239、GB20984、ISO90001、ISO27001；3、熟悉网络安全领域的相关专业技术知识、标准和相关安全产品（防火墙、UTM、IPS、IDS、审计、漏洞扫描、SOC）及服务(渗透测试、风险评估、应急响应)；4、熟悉国际信息安全等级保护的政策和相关技术标准，具有信息安全等级测评经验；5、有优秀的沟通能力和写作能力，具备极强的PPT编写能力以及售前标书能力。优先考虑的条件：具有CISSP、CISP、CCNP、CCIE、RHCE、PMP、ITIL等证书者优先；具有乙方安全公司服务经验者优先。,上市公司,1000,5000,"计算机软件,计算机服务(系统、数据服务、维修)"
景观总监,四川蓝光生态环境产业有限公司,5-7年经验,大专,成都,200000,300000,岗位职责：一、业务职责1、协助咨询管理组项目统筹工作，组内工程任务划分，组织项目的施工调查、项目策划以及管理规章制度交底工作。2、负责项目管理工作，负责牵头组织项目管理督导组开展工作，负责对承建的工程项目进行监管、及时处理实施中出现的施工组织、技术、质量安全管理、工程实体质量等方面的各类问题，负责对项目部监管工作进行考核通报。3、协助负责管理项目招投标相关事宜、图纸会审和重难点工程项目的技术总结编写、审查工作。4、协助负责项目合同管理、生产调度工作，确保公司生产指令和信息的畅通，负责工程项目信息系统管理工作。5、负责项目统计工作，编制上报项目年（季、月）度定期统计报表，对项目经营生产情况进行分析6、对管理项目进行专业检查，管控项目时间、质量、品质和安全。7、负责收尾项目管理，参与建设项目的竣工交验，协助。8、参与施工技术方案审查和重难点工程技术攻关，提供技术指导和技术服务。9、参与供应商和分包单位的管理。二、管理职能1、配合质量效果管理检查；2、配合工程管理制度的建立和修订，并进行检查和考核；3、贯彻执行公司标准化制度，对标准化运用执行情况进行检查和考核；4、做好人才梯队建设，组织培训和业务指导。三、其他1、负责完成所属区域下达的工作计划，完成部门的内控计划。任职要求：一、基本素质1、30-45岁，大专及以上学历，园林、工程管理、建筑工程等相关专业；2、七年以上景观工程管理经验，三年以上项目团队管理经验；二、专业素质1、中级及以上职称；2、一级资质景观工程企业工作经历优先；3、熟悉景观技术管理路线，能合理管控项目质量。三、其他1、良好的执行力、分析判断、沟通能力；2、工作仔细，反应迅速，有一定分析能力；3、抗压能力强，有责任心，积极向上。,上市公司,500,1000,"房地产,建筑/建材/工程"
IT主管（连锁宠物医疗）,瓴域（上海）投资有限公司,3-4年经验,大专,江西省,4000,6000,岗位职责：1、总部IT指示下传达业务操作规范的各项标准，协助监督各分子公司实施情况，保持日常工作沟通和协调；根据公司发展战略，逐步拓展信息系统管理范围和深度，充分发挥信息化在企业管理中的积极作用；在总部IT带领下建立和完善信息化建设和管理的各项规章制度，实现管理的规范化、制度化、模板化；2、配合公司相关部门进行固定资产清理和盘点，对资产进行标示登记；3、监控、维护公司各业务系统并确保数据安全、正常使用；定期检查IT设备、通讯设备、网络设备及其附属配件的使用情况，建立这些设备和配件的备用机制和采购计划，提请相关部门进行采购处理，以满足公司日常工作需要；4、负责反馈各部门提出的业务系统BUG、功能需求等，帮助完善改进业务系统；5、参与组织公司业务系统培训，根据业务需求在系统中实现操作流程，为公司其他部门提供技术优化服务；6、处理常见服务器和PC系统故障、处理基本的网络通讯故障以及信息系统设备的维护。任职资格：1、大专及以上学历；2、3年以上工作经验；3、从事过网络工程\系统实施\项目管理等某种工作，在快消品、零售连锁、工厂制造业等某行业长达6年以上的优先；4、执行能力优秀、学习能力优秀、沟通能力优秀。,外资（非欧美）,1000,5000,"金融/投资/证券,互联网/电子商务"
运维工程师-业务稽查与管控运维,武汉中启文科技有限公司,3-4年经验,本科,武汉-青山区,4000,8000,"湖北省电力计量中心 业务稽查与管控运维 业务管控职位要求：1、本科及以上学历，计算机及其相关专业；2、有过3年及以上、3个项目及以上信息系统集成的实施或运维经验，具备一定的项目管控能力；3、熟悉电力营销相关知识，有电力相关信息系统的运维工作经验优先；4、熟悉常用数据库体系结构，掌握SQL语句、存储过程的编写；5、具有良好的人际交往与沟通协调能力,确保各方工作顺利推进；6、踏实认真的工作态度：注重细节，工作细心，有较强的抗压能力；7、优秀的文案撰写能力：结构清晰合理、重点突出，文字深入浅出，可读性强。工作内容：1、负责依据常态化运行管理机制开展计量关键业务和数据管控日常管理及考核评价工作；2、负责与国网营销部和计量支撑组保持高效沟通，确保及时组织落实国网公司相关工作要求；3、负责协调相关资源确保营销基础数据平台和营销业务管理平台等系统性能、功能满足应用要求；4、负责指标规则、指标核查脚本、指标监控频次、系统应用情况、问题数据展示和数据整改质量的总体管控；5、负责组织营销业务管理平台功能部署及应用推广、培训、操作手册和作业指导书编制及典型案例库建设；6、负责协调解决影响计量关键业务和数据管控工作开展的问题。7、负责跨专业稽查工作的协调工作。",民营公司,50,50,"计算机服务(系统、数据服务、维修),批发/零售"
事业部总经理,四川蓝光生态环境产业有限公司,无工作经验,大专,成都,600000,800000,岗位职责：一、业务职责1、负责区域内公司所有业务的经营统筹管理，包括咨询业务、装饰/景观施工业务、设计业务等；2、对所负责区域内业务的合同产值指标、利润指标等经营指标负责；3、负责区域内所承接项目统筹工作，组内工程任务划分，组织项目的施工调查、项目策划以及管理规章制度交底工作。4、负责项目管理工作，负责牵头组织项目管理督导组开展工作，负责对承建的工程项目进行监管、及时处理实施中出现的施工组织、技术、质量安全管理、工程实体质量等方面的各类问题，负责对项目部监管工作进行考核通报。5、负责管理项目招投标相关事宜、图纸会审和重难点工程项目的技术总结编写、审查工作。6、负责项目合同管理、生产调度工作，确保公司生产指令和信息的畅通，负责工程项目信息系统管理工作。7、负责项目统计工作，编制上报项目年（季、月）度定期统计报表，对项目经营生产情况进行分析8、对管理项目进行专业检查，管控项目时间、质量、品质和安全。9、负责收尾项目管理，参与建设项目的竣工交验，协助。10、参与施工技术方案审查和重难点工程技术攻关，提供技术指导和技术服务。11、参与供应商和分包单位的管理。二、管理职能1、配合质量效果管理检查；2、配合工程管理制度的建立和修订，并进行检查和考核；3、贯彻执行公司标准化制度，对标准化运用执行情况进行检查和考核；4、做好人才梯队建设，组织培训和业务指导。三、其他1、负责完成所属区域下达的工作计划，完成部门的内控计划。任职要求：一、基本素质1、30-45岁，大专及以上学历，民建、工程管理、建筑工程等相关专业；2、七年以上工程管理经验，三年以上项目团队管理经验；二、专业素质1、中级及以上职称，一级建造师优先；2、一级资质装饰企业工作经历优先；3、熟悉装饰技术管理路线，能合理管控项目质量。三、其他1、良好的执行力、分析判断、沟通能力；2、工作仔细，反应迅速，有一定分析能力；3、抗压能力强，有责任心，积极向上。,上市公司,500,1000,"房地产,建筑/建材/工程"
慧云工程师(强电、弱电、暖通),镇江万达广场商业管理有限公司,3-4年经验,本科,镇江,6000,7000,慧云工程师就是智能化信息系统管理工程师慧云系统通过中央控制中心，集成消防管理、安防管理、设备管理、运营管理、节能管理五大目标等16个子系统，同时实现了一个房间、一个平台的集中监视、控制和管理。岗位职责：1、负责编制慧云各系统运行模式，上报审批；2、负责慧云各系统设备日常运行参数、运行方式的监控；3、负责慧云各系统设备的完好性；4、负责跟踪与慧云有关设备问题的处理结果；5、对慧云系统设备运行参数进行存档。任职资格：1、本科（统招）及以上学历，暖通、电气、计算机应用、控制、自动化等专业；2、3年以上相关工作经验，40周岁以下；3、需倒班，不接受夜班勿投。福利待遇：1、带薪年假，每年三天带薪病假；2、五险一金，额外为每位员工购买一份商业险；3、有员工食堂，免费提供工作餐；4、发放节日福利；5、每年一次免费员工体检；6、每年举办员工活动；7、具有相关专业培训，有一定晋升空间；8、年底发放年终奖金。,民营公司,150,500,"物业管理/商业中心,房地产"
韩语/朝鲜语人才,乐金显示（中国）有限公司,1年经验,本科,广州,5000,10000,"乐金显示光电科技(中国）有限公司隶属于LG集团，是国内国企与韩国LG集团联合投资的中外合资企业，投资金额约460亿。LG集团在广州黄埔区LG产业园先后投建了LCD生产法人——乐金显示（广州）有限公司&amp;乐金显示（中国）有限公司，为了适应新的市场需求和产品更新形势，现在同一园区建立第三工厂——乐金显示光电科技（中国）有限公司，新法人以大尺寸OLED显示屏为主要产品。较传统液晶显示屏，OLED屏具有更纤薄、色谱全、色彩饱和、可弯曲、节能等优势，是未来电视发展的大势所趋！在广州市地标建筑——广州塔内建设的OLED可弯曲时光隧道体验馆已开始对外运营，同时在北京/上海/深圳/南京等各大主要城市建设OLED体验馆。更多详情请点击：pan.baidu.com/s/1htzDWyw,提取码：08ed。OLED，未来视觉盛宴，我们期待您的加入！职位描述：该岗位可根据个人意愿选择以下岗位：1、【技术类】】工厂各技术部门设备、工程、品质、生产管理等领域工程师；2、【经营管理类】财务、进出口、企划、公关、采购、信息系统管理、法务等部门岗位；3、【总务支援类】总务、安全管理、信息安全，宣传等部门岗位；任职要求：1、全日制本科以上学历。韩语高级水平，流畅的听说读写能力；2、工程师类要求理工科类专业背景，如机械、电气、电子、物理、化工、工业工程、生物、计算机、环保等专业。",外资（非欧美）,1000,5000,电子技术/半导体/集成电路
系统管理员,上海市金茂律师事务所,2年经验,本科,上海-黄浦区,6000,8000,职位描述：1. 按照实施计划，配合律师事务所信息系统实施部署；与供应商学习、协调解决系统的基础信息维护、设置、管理，定期分析评估流程运行效果，根据需求进行系统优化、权限调整、基础信息更新、帐号管理等操作；２. 按照事务所要求协助进行现场培训和指导，进行事务所内部系统使用帮助文档的编写，完成系统实施进度报告，实施总结等；３. 在系统维护管理过程中，对律师的需求进行诊断，提出合理性建议和解决方案，及时、有效的解决系统使用过程中出现的疑难问题，提高律师满意度和系统使用体验；就有关事项与供应商联络。4． 服从事务所行政部、IT主管所指派的其他工作事项。任职条件：1. 本科以上学历，计算机相关专业，2年以上相关工作经验；2. 有从事企业IT工作、企业管理信息系统管理、用户培训经验；3. 具有OA系统实施、维护、培训方面的经验者优先；4. 具备一定的SQL server数据库的操作和维护知识和维护能力，有一定的技术（html编写）基础；5. 对路由器，交换机，VLAN，防火墙，负载均衡交换机的配置和管理有一定了解和运维基础；6.能熟练对Exchange服务器、域控服务器权限管理、配置和使用者优先考虑；7. 能够胜任项目实施方案的撰写、需求分析和建议书的编写；8. 具备良好自信心，有较强的口头表达能力、人际沟通能力；9. 有良好的团队精神和严谨的工作态度，能够适应一定的压力工作。,民营公司,150,500,法律
单证员,深圳市美联保险经纪有限公司,1年经验,大专,深圳-南山区,60000,80000,岗位职责：一、 耐心接受各种险种客户需求的咨询（货运险、车险、财产险等非水险），定期维护客户及处理客户投诉；二、完成货运险、财产险、非水险等险种初级核保及出单，以及后续续保客户咨询、服务等工作；三、配合上级主管，进行各种险种单证的打印、客户发票打印、核对保险单据、合同及其单证管理、分类、处理、寄送客户等工作；四、定期与保险公司及公司合作方进行业务核对、负责客户信息系统管理、维护工作；五、完成相关保险业务后续客户的收款工作、并将发票及其合同等客户所需材料寄送客户，做好服务工作；六、收集客户资料、报价等，对相关资料进行整理、分析；文件归档及管理工作；七、认真完成公司及上级领导交办的其他临时性事宜。任职要求：一、保险、商务英语、国际贸易、物流等相关专业；二、擅长读写英文，英文四级及以上；三、大专及以上学历四、打字速度快，熟练使用word\excel等办公软件；五、做事认真负责、有耐心、踏实勤恳，具有较强的沟通能力。公司福利待遇：1. 5天7.5小时工作制，周末双休；（9：00-17:30）2.国家法定节假日休息，依法享受带薪年假、婚假、产假等；3.每月设有全勤奖200元/月4.基本薪酬+各种补贴+全勤奖+提成；5.入职即购买五险一金及附加保险商业险、团意险；6.丰富多彩的员工活动 (各种省内省外旅游、聚餐、生日会、文体活动、户外拓展活动)。地址：深圳市南山区科技园中区科技中三路国人通信大厦（深大地铁站A3出口500米）附近公交站：科苑北、深大北门,民营公司,150,500,"保险,中介服务"
系统管理员,上海市金茂律师事务所,2年经验,本科,上海-黄浦区,6000,8000,职位描述：1. 按照实施计划，配合律师事务所信息系统实施部署；与供应商学习、协调解决系统的基础信息维护、设置、管理，定期分析评估流程运行效果，根据需求进行系统优化、权限调整、基础信息更新、帐号管理等操作；２. 按照事务所要求协助进行现场培训和指导，进行事务所内部系统使用帮助文档的编写，完成系统实施进度报告，实施总结等；３. 在系统维护管理过程中，对律师的需求进行诊断，提出合理性建议和解决方案，及时、有效的解决系统使用过程中出现的疑难问题，提高律师满意度和系统使用体验；就有关事项与供应商联络。4． 服从事务所行政部、IT主管所指派的其他工作事项。任职条件：1. 本科以上学历，计算机相关专业，2年以上相关工作经验；2. 有从事企业IT工作、企业管理信息系统管理、用户培训经验；3. 具有OA系统实施、维护、培训方面的经验者优先；4. 具备一定的SQL server数据库的操作和维护知识和维护能力，有一定的技术（html编写）基础；5. 对路由器，交换机，VLAN，防火墙，负载均衡交换机的配置和管理有一定了解和运维基础；6.能熟练对Exchange服务器、域控服务器权限管理、配置和使用者优先考虑；7. 能够胜任项目实施方案的撰写、需求分析和建议书的编写；8. 具备良好自信心，有较强的口头表达能力、人际沟通能力；9. 有良好的团队精神和严谨的工作态度，能够适应一定的压力工作。,民营公司,150,500,法律
