职位名称,公司名称,经验要求,学历,工作地点,最低薪水,最高薪水,职位描述,公司类型,最低员工人数,最高员工人数,主营业务
系统工程师,杭州市民卡有限公司,无工作经验,本科,杭州-上城区,8000,13000,"岗位职责：1.负责数据中心及容灾中心服务器和存储等设备的安装、配置、管理、维护及监控工作；2.负责加固系统、优化系统，提升系统安全性；为核心生产数据库应用提供坚强的系统平台支持；3.负责数据中心及容灾中心服务器和存储设备的故障处理和定期巡检工作；快速处理实际运行中遇到的各种系统问题；4.负责公司备份系统日常管理与维护；5.对公司集成项目提供系统方面的技术支持工作；6.负责虚拟化平台和备份系统故障诊断处理及企业内部IT系统技术支持工作；7.参与公司年度基础架构项目架构规划、技术选型、实施工作。基本要求：1.计算机相关专业全日制本科或以上学历，8年以上信息系统管理、网络管理或数据库管理工作经验及安全防护经验的相关经验；2.具有扎实的计算机基础知识，熟悉主流的 X86服务器、小型机的安装配置和维护工作；具有Linux 和Windows 的管理技巧及经验，有解决系统或内核级别的配置问题的经验；3.具有基本的网络基础知识，能够处理操作系统层面的网络问题；4.能够对IBM、EMC储品牌中的一种进行基本的操作和配置，理解存储的基本工作原理；5.熟悉主流数据库(oracle,mysql,sqlserver等)、企业级备份软件(TSM,NBU等)的安装配置及维护；6.熟悉虚拟和物理带库及重删带库日常管理与配置；7.掌握基本的网络使用知识, 包括使用 ping 及 traceroute 等基本工具来分析网络问题；8.理解X86服务器虚拟化技术,熟悉VMware,Xen整体架构,具有实际部署经验，对VMware的存储、网络、灾备、安全、虚机管理、监控和性能、troubleshooting等有深刻的理解,可优先；9.较强的动手能力、应急变通的能力、独立解决问题的能力，具有分析复杂问题，解决复杂问题的动手能力；10.有良好的工作态度与团队合作精神，认真仔细、善于协作、强烈的责任心，能承受一定工作压力。",国企,150,500,"金融/投资/证券,政府/公共事业"
IT ERP主管,上海乐去做信息技术有限公司,3-4年经验,本科,上海-长宁区,16000,20000,岗位职责：1、根据公司的发展规划，制定ERP系统相应的规划；完成ERP功能的需求分析和模块设计。2、根据公司发展战略，逐步拓展信息系统管理范围和深度，充分发挥信息化在企业管理中的积极作用。3、建立公司产品管理系统和综合服务系统，为客户提供产品管理平台。4、根据ERP系统数据，对客户的需求进行分析、评估并组织开发和实施；挖掘客户信息化潜在需求。5、带领ERP团队及相关系统的日常维护及更新系统的上线工作。任职要求：1、 全日制本科及以上学历，计算机、网络、信息系统等相关专业，5年以上计算机行业相关工作经验；2、两年以上ERP系统实施、管理及维护经验，熟悉服务业企业流程，有敏锐的商业嗅觉；3、熟悉SQL SERVER、ORACLE等流行数据库，掌握基本的SQL查询维护；4、了解产品管理，能将需求转换为系统功能；良好的数据分析能力和文档编写能力；5、性格开朗，具有良好的团队合作精神和较强的沟通协调能力，工作认真负责，有耐心并能承受一定的工作压力。,民营公司,50,50,"计算机软件,互联网/电子商务"
信息主管,大卫茂国际购物中心,2年经验,大专,南京,4500,6000,专业要求：计算机相关专业技能水平：1.熟悉信息部工作职责和工作范围，熟知信息岗位的工作规范；2.掌握信息系统管理软件；3.熟悉国家、地区关于信息方面法律法规；4.熟悉办公软件管理软件的使用；5.具备良好灵活性。工作经验：1.三年以上工作经验；2.两年以上大中型零售企业工作经验；3.一年以上同等职位工作经验。,民营公司,50,150,"物业管理/商业中心,房地产"
信息化系统运维经理,华测检测认证集团食品药品农产品及保化产品事业群,5-7年经验,本科,南京,200000,300000,"岗位职责：1、负责本事业部各类信息系统运营与管理，重点负责实验室信息化管理系统（LIMS）；2、协助公司和本事业部各类信息系统有关供应商选择、谈判；3、协调事业部各业务、技术部门，主导制订并组织实施技术系统工作目标和工作计划；4、全面负责各项目的系统分析、设计、开发与需求调研；5、对事业部有关信息系统项目的阶段性验收负责；6、负责对LIMS及其他各信息化项目主管及团队的培训、指导及考核。任职资格：1、计算机管理类相关专业，本科以上，5年以上大中型企业信息系统管理工作经验；2、熟悉LIMS（或ERP）、CRM、OA等业务系统管理，具有IT项目管理经验，具备乙方带队或者甲方对接的实操经验；3、具有信息系统集成，远程信息管理，类集团化信息系统平台搭建经验；4、具备优秀的沟通和统筹能力,较强的组织协调能力；良好的团队合作精神和观察分析能力；5、诚信敬业、认真仔细、严谨高效，做事有条理,亲和力较强；6、熟练使用internet和电脑办公软件，英语基础良好；7、有检验检测行业系统建设经验者优先。工作地点：深圳、上海、南京、杭州***",上市公司,150,500,"检测，认证,专业服务(咨询、人力资源、财会)"
IT主管,达县升华商贸有限公司,3-4年经验,大专,达州,4500,6000,岗位职责：1负责公司网络的日常运维；2、负责电脑机房UPS、精密空调、监控和报警等系统的日常巡检，以及故障紧急处理；3、负责ERP系统、收银系统和辅助设备软硬件技术支持与维护，以及计算机病毒防范清理和故障紧急处理；4、协助各类系统设备硬件和软件安全防范、故障处理，以及资产信息化管理和清点；5及时完成公司领导交付的其他工作事项。岗位要求：1、熟练掌握企业办公涉及的信息系统管理软硬件安装、使用、维护；2、熟悉购物中心ERP系统，SQL、Server、Oracle、MYSQL数据库的运行机制和体系架构以及系统的调优；3、具备一定的IT机房设施和服务器管理经验；4、熟悉华为等主流路由交换设备的安装和调试；5、遵循与适应百货零售业IT部门特有工作作息时间和轮班工作周期。,民营公司,150,500,房地产
运营管理部总经理,中建材国际物产有限公司,8-9年经验,本科,上海-黄浦区,20000,30000,一、岗位职责1.  行业研究（1）组织部门员工研究国内外经济发展趋势、国内外进出口业务等相关产业政策，审核产业信息报告/期刊，对报告质量进行把关。（2）组织部门员工对公司业务相关的行业信息的搜集、分析，对业务增长点或业务创新模式提出建议。（3）负责制定标杆企业研究的内容框架，并组织跟踪研究，对研究的进度、成果进行把控。2. 期货管理（1）组织拟定并修订期货套保相关管理制度。（2）组织拟定年度期货套保计划，并监督执行。（3）组织制定期货套保方案。（4）组织对拟增加的期货套保业务进行研究分析、执行。（5）组织对期货与现货市场动态与发展趋势信息收集，对研究进度、报告质量进行把关。（6）负责对子公司期货套保机构的选择、账户的开立及执行方案进行审核，提出执行建议。3. 经营计划管理（1）负责对公司年度经营指标进行分解，经总裁办公会审议后，与各部门/子公司下达经营计划目标。（2）审核经营计划编制大纲，组织各职能部门及子公司计划编制。（3）审核公司年度经营计划，并及时上报。（4）审核子公司月度、季度、年度经营报表、及经营分析报告，提交至相关领导。（5）协助对子公司年度经营计划完成情况进行结果考核。4. 资质与资源管理（1）审核公司供应商、客户等第三方管理制度。（2）组织建立和维护公司供应商/战略性客户等第三方管理数据库。（3）组织对公司供应商、客户等分类管理、绩效评估及退出等工作。（4）负责对子公司非业务重大战略供应商、战略性客户进行备案审核。5. 业务管理（1）审核公司业务采购、存货、客户准入及授信等管理制度。（2）审核重大业务、高风险业务等重点业务的分级评定标准。（3）监督公司业务类采购管理的执行。（4）审核子公司的业务采购申请。（5）审核业务合同或业务项目担保合同。（6）审核子公司存货盘点分析报告。（7）协调公司总体经营计划，对业务进行资源整合、共享，引导、促进子公司间形成业务协同机制。6. 信息系统管理（1）组织制定公司信息化建设发展规划、信息化系统管理制度。（2）审核公司及子公司的信息化方案。（3）监督公司信息化系统、软件、硬件的日常运维、优化升级、运营评价及管理工作的执行。7. 安全生产管理（1）负责接收、下达国家、上级单位有关各项管理安全管理规章制度及政策。（2）审核公司的安全管理制度。（3）组织建立公司的安全生产目标责任机制。（4）组织编制安全生产年度计划。（5）协助处理重大安全生产事故及善后事宜。（6）负责对子公司安全管理情况进行考核。8.其他（1）组织开展财政扶持项目的申报、组织实施、检查验收等工作。二、任职资格1. 身体素质良好。2. 第一学历大学本科及以上。3. 国际贸易、企业管理、经济学、战略管理、金融等相关专业毕业，党员优先。4. 英语六级，能作为工作语言尤佳。5. 具有较好的企业战略规划、项目可行性分析、项目评估、金融、财会、法律、投资等方面的专业知识；熟悉进出口贸易、大宗商品行业相关政策；熟悉进出贸易口行业相关政策；了解市场管理、经营管理相关知识；具有良好的企业运营、金融、财会、法律等方面的专业知识，熟练使用办公软件。6. 5年以上战略管理工作经验，其中2年以上大中型集团企业总部战略部门负责人岗位工作经验；具有3年以上国际贸易业务、运营管理工作经验。7. 具有良好的分析能力、决策能力、领导监督、沟通能力、组织协调、商业意识、人际交往、学习能力、抗压能力、团队合作、执行力、创新能力和进取心。,国企,500,1000,"贸易/进出口,原材料和加工"
IT主管,上海否泰投资有限公司,2年经验,大专,上海-闵行区,6000,8000,依据公司整体管理要求，组织制订并实施公司IT管理制度，拟定、改善本部门业务规章及工作流程；规划、设计、改善和管理公司的BBC、DRP、webpose、ERP、IM系统；公司内部(包括分公司)网络架构的设计、构建和管理；公司内部平台（350云仓、钉钉、企业邮箱）的管理、运营和维护；公司信息系统的服务器管理、运营和维护；公司各部门（包括省级公司及分公司）相关的技术支持；公司内部网络安全架的设计、管理、防范与运营；公司办公电脑、打印机、会议室设备的等公司硬件的管理、运营和维护；挖掘公司管理的需求、及时办好入离职人员的邮箱开启及关闭，电脑交接文件的备份、电脑密码的重置；培训、监督、管理、改进公司的相关系统使用团队，提高服务态度和服务质量，提高部门在公司内部的满意度；协调公司各部门内外与公司所有平台及系统的相关联的外部企业的管理工作。任职资格1、专科及以上学历，计算机专业或信息系统管理专业；2、1年以上系统管理工作经验；3、有ERP、OA系统管理经验者，会网站设计者优先考虑4、有“吃苦心”、“事业心”、“责任心”和学习能力；5、有良的心理素质、强烈的团队精神、善于与人的沟通，能按时、保质完成工作，讲究实效；6、有良好的职业道德，诚实、积极主动的工作态度。,民营公司,50,50,"中介服务,互联网/电子商务"
人事专员,云南俊发物业服务有限公司,无工作经验,大专,昆明,3000,4500,1、做好人力资源信息系统管理工作，及时完成各项人事报表的统计、分析、上报 。2、熟练办理劳动合同及社会保险，并及时更新及管理 。3、负责公司考勤管理工作，对员工出勤情况进行定期核查。4、根据相关规定及时办理员工的养老保险、医疗保险、工伤保险、生育保险、失业保险，并对员工产生的所有质疑进行解释。5、建立、完善人事档案管理工作 。6、季度奖金+年终效益奖金+通信补贴+技能补贴，正式录用后签订劳动合同及购买五险一金，周末双休。任职要求：1、大专及以上学历，人力资源管理专业、管理学专业优先；2、有1-3年工作经验者优先；3、熟悉劳动法相关法律法规，能承受较大工作压力；,民营公司,1000,5000,"物业管理/商业中心,酒店/旅游"
仓储经理（奉化）,三江购物俱乐部股份有限公司,3-4年经验,大专,宁波-奉化区,4500,8000,岗位职责：1、仓库布局的规划 根据自己的产品性质作区域划分，储存区（分为临时，长期，货架，整件），检验区，待发区，返货区，分拣区，出货口，进货口，安防规划，根据季节性销售对货物的存放位置进行调整，重货，发货频率高的靠近出货口，根据货物性质，需要隔离的做好隔离；2、仓库制度制定，操作流程制定 仓库管理规范，员工管理规范，员工守则，安防制度，进货流程，发货流程，返货流程，盘点流程，报损流程，临时储存流程，作业工具管理规范；3、员工绩效考核 员工及团队绩效考核标准制定，考核表格制定，作息安排；4、客户管理 客户档案建立，客户关系维护，产品送达的沟通；5、信息系统管理 信息系统的建立，信息数据的分析，确保仓储信息准确，信息系统与实物的百分百符合；6、成本控制 合理的人员配置，仓库的使用率，办公用品的折旧消耗品的消耗，运输成本的核算；7、安全库存分析 通过以往经验对每个季度销售或会计周期进行预测，库龄评估，避免呆滞死货占用资金。任职要求：1、大专及以上学历，28周岁以上；2、3年以上仓库管理经验，20人以上团队管理经验；3、有百货类仓储经验优先。上班地址：奉化方桥恒丰路133号注：如不能接受工作地点，请勿投递，谢谢！单先生 13780000588,上市公司,5000,10000,"批发/零售,快速消费品(食品、饮料、化妆品)"
售前工程师,南京华苏科技有限公司,5-7年经验,本科,成都-武侯区,8000,10000,岗位职责：协助四川移动开展ICT售前技术支撑、售前技术方案制作、评审，售前项目造价评估，售前标书制作技术部分、售中项目监控，ITC项目分析，ICT重点领域研究以及规划管理等。任职资格1)本科及以上学历，工作经验要求不少于5年，具备运营商支撑经验（专业要求：信息技术类、通信工程类、网络工程类、计算机类、电子技术类、系统集成类、物理工程类专业）；2)熟悉ICT技术解决方案撰写、口头表达有条理、有自信，现场应变能力较强，对ICT项目支撑有较为深刻的理解，有ICT支撑项目工作经验者优先考虑；3)  熟悉计算机及网络通信知识、网络数通设备、项目管理知识，能独立编写大型IT系统集成项目技术方案；4)  具备软件设计师或系统集成项目管理工程师或信息系统管理工程师或CCNP或华为、中兴等网络高、中级认证或（通信类、计算机类、网络工程类、系统集成类、软件工程类）高或中级职称等优先考虑；5)  有良好的心理素质，具备良好的业务理解分析能力、沟通协调能力和判断力；6)  善于搜索和提炼互联网上有价值的技术信息，理解并应用于项目售前过程中。,民营公司,1000,5000,"通信/电信/网络设备,通信/电信运营、增值服务"
（福田）高级ERP实施工程师,深圳市有信达供应链集团股份有限公司,3-4年经验,大专,深圳-福田区,7000,10000,1.3年以上企业ERP系统等相关信息系统管理、应用运维及开发工作经验；2.熟悉制造型企业ERP系统管理及运维工作经验优先，有物流行业背景优先；3.熟悉大型厂商的集团版ERP系统（如：金蝶、用友等）的运维；4.熟悉ERP等信息系统相关功能模块的业务逻辑；5.熟悉企业信息化管理系统的应用运维与相关开发工作；6.熟悉Oracle、SQL Server等数据库使用及管理，能熟练编写SQL语句；8.具备企业信息化、ERP等项目实施经验；9.熟悉ERP等信息系统的业务架构及二次开发原理。,民营公司,1000,5000,交通/运输/物流
网络专员,广东海逸房地产集团有限公司,2年经验,大专,佛山,4500,6500,岗位职责：1、负责集团总部内部网络、AD域、VPN和各服务器的建设及日常维护、定期备份管理；2、负责集团总部业务软件的技术管理工作，各信息化平台系统维护、修复、二次开发及培训（含OA、HR、ERP、财务系统K3\NC等)；3、负责定期通过后台数据对各信息化系统进行业务数据进行分析并形成报告汇报；4、负责计算机软硬件安装、修复、问题解决；协助信息化设备硬件处理；负责集团总部多方视频会议系统使用管理工作；5、上级领导交待的其它信息化相关工作。任职要求：1、本科以上学历，计算机网络或信息化工程管理专业；2、掌握计算机知识（包括计算机网络、软硬件的基础知识）、信息化工程管理知识；3、具备网络的建立、维护与计算机软硬件的安装、调试、维护能力以及沟通和表达能力；4、具备3年以上计算机维修、护理、网络信息系统管理和网站建设经验。,民营公司,150,500,房地产
档案信息管理岗,中广核服务集团有限公司,无工作经验,本科,深圳-福田区,5000,8000,岗位要求：1、学历：大学本科2、专业：信息资源管理/档案学3、年龄：28岁以下4、资质或职称：无5、工作经验：有文档工作经验者优先6、具备能力：计算机应用水平良好、写作能力良好岗位职责：文档信息系统管理：1、根据用户对档案管理和利用的需要，与技术部门沟通，对档案管理信息系统开发、升级、改造，并完成信息系统日常管理及维护；2、负责档案信息系统应用的数据维护、加工、应用和日常管理。3、负责档案数据的整理、分析并撰写分析报告。负责档案的日常管理。,国企,5000,10000,"多元化业务集团公司,环保"
IT 系统工程师,重庆翊宝智慧电子装置有限公司,3-4年经验,本科,重庆-渝北区,5000,8000,1. 责任心强，执行力强2. 细心，专注，具有信息安全意识3. 需服从主管工作安排，配合生产加班和夜班轮值任职要求：1. 计算机相关专业，本科以上学历，有意愿从事信息系统管理者优先2. 须精通Windows server和Linux操作系统的安装、维护、管理3. 须熟悉HP、Dell等主流服务器产品的安装、维护、管理4. 熟悉Windows domain管理，Microsoft Exchange server、File server、Web IIS server、ISA server、Printer server等应用系统的安装、维护、管理者优先5. 熟悉Vmware平台系统安装、维护、管理者优先6. 熟悉数据备份策略和备份软件(如：Symantec veritas系列)安装、维护、管理者优先7. 熟悉PRTG、Cacti、Big Brother监控软件维护、管理者优先8. 熟悉服务器系统架构，有独立建置服务器系统经验者优先9. 具有3~5年服务器系统管理经验，具备MCSE，VM，Liunx等相关认证者优先,外资（非欧美）,10000,10000,电子技术/半导体/集成电路
人事专员/行政专员/信息专员,恒大地产集团大连有限公司,5-7年经验,本科,大连-沙河口区,10000,15000,工作经验7年以上薪资待遇：9500元/月起招聘条件：27～40岁，人力资源、行政管理、信息系统管理等相关专业本科及以上学历，第一学历本科毕业5年以上，5年以上相关岗位工作经验。请应聘者于2017年3月19日参加现场招聘会招聘会时间：2017年3月19日（9:00-16:30）地点：大连恒大公园大道项目销售中心（大连市开发区滨海大道与赤峰街交会处）咨询电话：39701718简历投递邮箱：hddlhr@evergrande.com请应聘者携带身份证、毕业证、学位证复印件，自备简历一份（内容包含毕业院校及专业、工作经验，附照片）招聘会现场乘车路线：星海会展中心会展路大连之夜、星海味道路边乘恒大地产大连公司招聘会专用车辆前往，早8:00开始循环发车，每整点、半点发车一次。,民营公司,150,500,房地产
售前工程师,深圳市中科新业信息科技发展有限公司,3-4年经验,大专,深圳-南山区,8000,10000,岗位职责：1、主要协助市场营销人员与客户进行技术方面的沟通与交流；2、负责公司产品线售前技术支持，包括产品讲解演示、方案撰写、投标协助等；3、及时了解与掌握客户真正的需求，引导客户熟悉了解本公司产品；4、根据客户需求替客户编写完整的解决方案，演示文档等促进销售。任职要求：1、大专以上学历，2年以上系统集成相关工作经验；2、精通网络知识 ，熟悉网络安全基本结构和网络安全产品体系；3、熟悉国内网络安全市场现状；能适应出差；4、具有较强的方案编写能力，较好的口头表达能力及客户沟通能力；5、持有信息系统管理师资格证书优先考虑。,民营公司,50,150,"计算机软件,计算机服务(系统、数据服务、维修)"
人事专员,广东英科集团股份有限公司,1年经验,大专,东莞,3000,5000,"岗位职责:1、协助日常人员招聘、考勤、行政服务与后勤总务的支持工作。2、协助制定、监督、执行公司人事管理及行政规章制度;3、负责维护公司HR管理系统的正常运行；4、完成领导交办的临时性工作。任职资格:1.大专以上学历，人力资源专业应届生（班干部或优秀毕业生优先）；2.具备1年以上人事管理工作经验者优先或熟悉人力资源信息系统管理者优先；3.须具备团队合作精神，工作态度积极，责任心强，认真、细致,有较强的亲和力，良好的人际关系处理能力、书面及语言表达能力和沟通能力；4、熟练操作相关办公软件。",民营公司,50,150,"印刷/包装/造纸,石油/化工/矿产/地质"
研究员（博士）,江西安驰新能源科技有限公司,无工作经验,硕士,上饶,6000,12000,"岗位要求：1、物理、工程热物理、化学、计算化学、电化学模拟、化工、高分子材料、材料、无机非金属、电子、电子电路、电气工程、机械自动化、机械设计、机械结构、机电一体化、流体力学、计算机控制、智能控制、通信、信息系统管理、数据库设计、工业设计及相关专业 ；2、硕士、博士及以上学历 ；3、熟悉锂电池、正极和负极材料隔膜、电解液或者参加过锂电池项目；4、35岁以下。咨询电话：0793-8829888,18870939155！",民营公司,500,1000,"新能源,电气/电力/水利"
